"id","content"
"31","Operator Login Scenario validation run 该服务是在明确要求后发起的 by the actor Operator The access to the screen 对系统的管理（例如 GUILogin) enter login and password and check the function 验证然后将控制传递给实例 GUILoginHandler委托给OperatoreManager的实例 管理后者处理的任务 验证使用面板输入的数据 The successful operator is notified of a backward up the application of which requires GUILoginHandler 到GUIPrincipaleHandler的实例来启用访问 患者申请人和该对象应显示 the main form (for instance GUIPrincipale) This feature is was described by the sequence diagram of 图3 2 "
"32","登录验证操作员方案失败 这项服务是在明确要求之后发起的 由演员操作员访问屏幕 对系统的管理（例如 GUILogin) enter login and password and check the function The validation then passes control to the instance of GUILoginHandler which delegates to the instance of OperatoreManager 管理后者处理的任务 验证使用面板输入的数据 通知负面结果的操作员 backward up to the instance of which shall GUILoginHandler to display an error message on mask GUILogin This feature is was described by 图3的序列图3 "
"33","插入anagrafica实验室 该服务是在明确要求后发起的 由演员操作员登录形成 主（例如G​​UIPrincipale）并在那里选择功能 然后实验室认证管理控制 GUIPrincipaleHandler给代表哪个应用程序的实例 GUIAnagraficaLaboratorioHandler to the task of providing the The service first step is to obtain a list of all Laboratories therefore control passes to the instance of LaboratorioManager通过它实验室的实例 检索列表并将其返回给应用程序 of GUIAnagraficaLaboratorioHandler Now that object 应显示收到的实验室名单 the mask on the management of database laboratories (for instance GUIAnagraficaLaboratorio) The Operator 激活实验室登记册的功能 插入新门诊的数据并确认数据 control passes to the instance of the GUIAnagraficaLaboratorioHandler 该代表团将包括一个新的实验室 LaboratorioManager的应用程序通过 The body of Laboratory to ensure the inclusion and saving data on the new lab passes the Subsequent GUIAnagraficaLaboratorioHandler which in turn deals with notification by the success of the 在屏幕上显示一条消息 管理实验室（例如 GUIAnagraficaLaboratorio）此功能已被描述` through collaboration diagram of Fig 3 4 "
"34","改变anagrafica实验室 该服务是在明确要求后发起的 by the actor The Operator logs on to form 主（例如G​​UIPrincipale）并在那里选择功能 然后实验室认证管理控制 GUIPrincipaleHandler to the instance of the delegation which application GUIAnagraficaLaboratorioHandler提供的任务 服务的第一步是获取所有的列表 因此，实验室控制传递给实例 LaboratorioManager通过它实验室的实例 retrieves the list and return it backward up the application of GUIAnagraficaLaboratorioHandler Now that object shall display the list of laboratories received the mask on the management of database laboratories (for instance GUIAnagraficaLaboratorio) The Operator 从实验室中选择以更改活动 审查实验室和登记册的登记功能 控制权传递给GUIAnagraficaLaboratorioHandler的实例 which delegates the task to collect data on the 实验室被选为LaboratorioManager的实例 The latter by the Laboratory of application shall 恢复提供这种数据的实例 GUIAnagraficaLaboratorioHandler反过来负责 他们对面罩GUIAnagraficaLaboratorio的看法 此时，操作员确认所做的更改 控制传递给GUIAnagraficaLaboratorioHandler的实例 将数据存储在实验室中的代表团 considered the application of LaboratorioManager latter through 实验室的主体为救援提供数据 altered passes control to the instance of GUIAnagraficaLaboratorioHandler which in turn deals with notify success by viewing a special message on the screen on the management 实验室的登记簿（例如 GUIAnagraficaLaboratorio）此功能已被描述` through collaboration diagram of Fig 3 5 "
"35","删除注册表 该服务是在明确要求后发起的 由演员操作员登录形成 main (for instance GUIPrincipale) and there select the function anagrafica医生管理控制 GUIPrincipaleHandler to the instance of the delegation which application GUIAnagraficaMedicoHandler to the task of managing the service The first step is to obtain a list of all doctors 因此控制传递给MedicoManager的实例 医生通过哪些实例检索列表和 向后返回到实例 GUIAnagraficaMedicoHandler Now that object shall 显示获得的医生名单 掩盖了医生注册的管理 （GUIAnagraficaMedico的实例）操作员选择 从你的医生被淘汰和主动功能 disposal of medical data of its monitoring and GUIAnagraficaMedicoHandler passes to the instance of the delegation which the task of finding data for selected medical 面板的MedicoManager应用程序 医生提供的恢复此类数据将提供应用程序 GUIAnagraficaMedicoHandler of which in turn takes care of them GUIAnagraficaMedico面具在这一点上展示 Operator confirms the changes made and control passes GUIAnagraficaMedicoHandler的代表团 to eliminate the doctor selected to the instance of MedicoManager latter through the application of Doctor to provide and passes control to the instance of GUIAnagraficaMedicoHandler反过来处理 notify success by viewing 管理屏幕上的特殊消息 医生登记册（例如GUIAnagraficaMedico）这 功能是由协作图来描述的 图3的6 "
"36","Record visit  此功能已被描述 图3的协作图21主要场景： service is started following the explicit request 操作员的演员部分访问掩码 主（例如G​​UIPrincipale）并在那里选择功能 The management visits then passes control to the instance of GUIPrincipaleHandler代表的实例 GUIVisitaHandler the task of providing the service The first step 是获取所有访问的列表 在门诊病人因此控制传递到的实例 VisiteManager通过迭代过程是货物 所有访问的检索和每一步都是在 如下所示：通过VisiteManager找到该面板 关于访问和访问的数据正文 then passes control to the instance of that EsamiManager 通过考试实例提供所有的查找 同一次访问的考试通过此列表 GUIVisitaHandler to the instance of which shall display 在面具上做的访问 管理访问（例如GUIVisite）运营商 select the function visiting placement insert data Visit the new and confirms control passes to the application GUIVisiteHandler of the delegation which is to enter the new visit to the instance of VisiteManager latter through Visit the panel and ensure the inclusion of rescue 新巡视和返回控制应用程序的数据 GUIVisitaHandler负责通知 成功通过查看一个 message in the form of management 访问（例如GUIVisita） "
"37","输入检查 该服务是在明确要求后发起的 由演员操作员登录形成 on the management of visits (for instance GUIVisita) 从访问中选择添加评估和 激活插入新检查控件的功能 然后到代表的GUIVisitaHandler的实例 GUIEsameHandler to the instance of the task of providing the service 第一步是找到有关信息 visit that the operator has selected therefore control passes The application of VisiteManager through the application Visit the retrieves information on the visit selected and passes control to the instance of that EsamiManager 通过检查机构发现了一份包含该清单的清单 information relating to the examinations visit The list is GUIVisitaHandler返回到接收实例 control and ensure display of the visit and 考试管理面具考试 （GUIEsami的例子） 操作员插入数据进一步检查和确认 在这一点上包含控制开关 GUIEsamiHandler to the instance of the delegation which is to enter a new examination of the application latter EsameManager 通过申请审查，以确保包容和 Saving data for further examination and passes control to the instance of GUIEsameHandler which in turn deals with 通过查看通知成功 在管理面具上的特殊消息 考试（例如GUIEsame）这个功能是 由图3的协作图22描述 "
"38","Access section patient performed (by code tax) The service was launched following the express request by the actor The Operator logs on to form on the management section of the patient (body GUILoginPaziente）插入Patient的税码 已提出请求并选择功能 验证然后将控制传递给实例 代表实例的GUILoginPazienteHandler PazienteManager负责管理服务的增长 deals to validate the data entered by using 病人的结果是身体 向后通知GUILoginPazienteHandler的实例 这需要使用GUIPazienteHandler来启用 由科病人访问 applicant and that object shall display main form (for instance GUIPaziente) This feature is ` 已经由图3的序列图13描述 "
"39","访问部分患者失败（通过代码 Hospital Card) 这项服务是在明确要求之后发起的 by the actor The Operator logs on to form 在患者的管理部分（身体 的GUILoginPaziente）插入医院卡的代码 已提出请求并选择功能的患者 validation control then the application of GUILoginPazienteHandler which delegates to the instance of HospitalCardManager the task of managing the service 后者负责验证输入的数据 通过申请医院卡失败 the transaction is notified backward up to the instance of 应显示GUILoginPazienteHandler 屏幕访问（应用程序 GUILoginPaziente）这个特性已经被``描述了 The sequence diagram of Fig 3 14 "
"40","Changing age Patient  The service was launched following the express request 由演员操作员登录形成 病人的主要部分（例如GUIPaziente）和那里 select the function for amending the register of Patient 提出请求并通过控制 GUIPazienteHandler以该代表团的实例为例 GUIAnagraficaPazienteHandler管理服务的任务A Now the control passes to the instance of GUIAnagraficaPazienteHandler委托任务 retrieve patient data on the applicant to the instance of Paziente经理通过申请病人的信 provides for recovery of such data and provides them to the instance of GUIAnagraficaPazienteHandler反过来照顾他们 display on screen GUIAnagraficaPaziente 此时，操作员确认所做的更改 Control goes back to the instance of GUIAnagraficaPazienteHandler委托任务 存储对数据所做的更改 患者关注这个PazienteManager的应用 by the panel shall rescue Patient Data 并在商店通过时进行修改 control of the application to which GUIAnagraficaPazienteHandler 轮到负责通知成功 通过显示消息 mask on managing the Patient （GUIAnagraficaPaziente的实例）这个特性是 由图3 15的协作图描述 "
"41","reservation a first visit The service was launched following the express request by the actor The Operator logs on to form 主（例如G​​UIPrincipale）并在那里选择功能 保留一次初始访问然后通过控制 GUIPrincipaleHandler给代表哪个应用程序的实例 GUIPrenotaVisitaHandler负责管理服务的任务 you are reservation a first visit passes control 其中的应用程序将GUIAnagraficaPazienteHandler the integration of anagrafica patient data  Creation of the new Patient  该应用程序显示类GUIAnagraficaPazienteHandler 输入anagrafica数据的掩码 Patient (for instance GUIAnagraficaPaziente) At this point 操作员插入患者的数据和确认 这样的数据，然后将控制传递给实例 GUIAnagraficaPazienteHandler谁搬到了实例 PazienteManager验证患者内部 如果患者的SIO“这不是手术可以” 然后继续GUIAnagraficaPazienteHandler代表团 PazienteManager创建新的任务的实例 患者由专家组成患者 根据操作员插入的数据创建新的患者  Creating the Hospital Card  PazienteManager类的应用程序通过控制 to the instance of HospitalCardManager which in turn means 医院卡的主体提供了一个新的创建 Hospital Card to be assigned to Patient A after the creation sends a notification message that the success 落后的实例 GUIPrenotaVisitaHandler  选择访问类型  类GUIPrenotaVisitaHandler的应用程序显示 mask on the reservation to visit the Patient must be subject (for instance GUIPrenotaVisita) On this 运营商选择表格并确认访问类型和 控制权返回到GUIPrenotaVisitaHandler的实例 which delegation is to include a new reservation to the instance of PrenotazioniManager  创建新的预订  The application of class through the application PrenotazioniManager 预订会在此时创建新的预订 预订的主体应核实有效性 预订或检查新的预订是否尊重 the sequence of reservations valid If the 预订是有效的预订应通知 创建保留的成功 后退到GUIPrenotaVisitaHandler的实例  查找可用数据  The application of the proxy class GUIPrenotaVisitaHandler 到Prenotazioni Manager找到第一个任务的实例 date available when the visit can ""keep this date is GUIPrenotaVisitaHandler给予其实例 to display it on form 预约参观（例如GUIPrenotaVisita） 经营者确认了系统和控制建议的日期 返回到GUIPrenotaVisitaHandler的实例  Storing data on Patient and Hospital Card  类GUIPrenotaVisitaHandler通行证的应用 GUIAnagraficaPazienteHandler控制应用程序 allow it to store data Patient 应用程序GUIAnagraficaPazienteHandler又被委托 存储与患者有关的个人数据 PazienteManager到通过应用程序的类的实例 数据中的患者永久存储在商店中 Control is returned to the backward class HospitalCardManager通过应用程序提供 医院卡抢救数据医院卡 对预约的患者进行一次访视 completion of the operations is returned to storage 向后传递一条消息，通知成功 to come to the instance of the class GUIAnagraficaPazienteHandler  Viewing and printing the Hospital Card  The application of the proxy class GUIAnagraficaPazienteHandler 查看和打印申请医院卡 类GUIHospitalCardHandler后者获取数据 Card on Hospital by the appropriate body to HospitalCardManager 在屏幕上显示数据 the Hospital Card (for instance GUIHospitalCard) and the delegation 打印医院卡到班级的实例 PrintManager control is returned backward to 到达应用GUIPrenotaVisitaHandler  storing reservation  The application of class GUIPrenotaVisitaHandler at this point 继续通过委托保存预订 PrenotazioniManager任务到这个应用程序的实例 通过申请保留应保存 data on the reservation Once this 操作控制传递给实例 GUIPrenotaVisitaHandler which in turn deals with notify success by viewing 预订屏幕上的特殊消息 a visit (for instance GUIPrenotaVisita) 该功能是由该合作描述的 diagram of Fig 3 16 "
"42","reservation for a visit after initial 该服务是在明确要求后发起的 由演员操作员登录形成 病人的主要部分（例如GUIPaziente）和那里 然后检查预约访问的功能 第一个控件然后传递给的实例 GUIPazienteHandler which delegates to the instance of GUIPrenotaVisitaHandler the task of managing the service  选择访问类型  类GUIPrenotaVisitaHandler的应用程序显示 mask on the reservation to visit the Patient must be subject (for instance GUIPrenotaVisita) On this 运营商选择表格并确认访问类型和 控制权返回到哪个GUIPrenotaVisitaHandler的实例 委托任务来插入一个新的应用程序 的预订管理器  创建新的预订  通过应用程序Prenotazioni管理器的应用程序 reservation creates a new reservation, at this point 预订的主体应核实有效性 预订或检查新的预订是否尊重 the sequence of reservation valid If the 预订是有效的预订应通知 success of the creation of a reservation 后退到GUIPrenotaVisitaHandler的实例  查找可用数据  代理类GUIPrenotaVisitaHandler的应用 to the instance of PrenotazioniManager task of finding the first 访问时可以保留这个日期的日期是 GUIPrenotaVisitaHandler given to the instance of which shall to display it on form reservation a visit (for instance GUIPrenotaVisita) 经营者确认了系统和控制建议的日期 返回到GUIPrenotaVisitaHandler的实例         节省预订  此时应用类GUIPrenotaVisitaHandler proceed to store the reservation by delegating this PrenotazioniManager task to the instance of this application 通过申请保留应保存 关于预订的数据一旦这样 操作控制传递给实例 GUIPrenotaVisitaHandler which in turn deals with 通过查看通知成功 预订屏幕上的特殊消息 参观（例如GUIPrenotaVisita） This feature is was described by the collaboration diagram of Fig 3 17 Also because? the book a 门诊服务是它的核心 `is thought to comment on that functionality with un'activity diagram (Fig 3 18) in order to make more clear the iterations that we are among the players and the system itself "
"43","在稍后的日期访问时滑倒 The service was launched following the express request 由演员操作员登录形成 病人（例如GUIPaziente）和那里的部分 检查更改预留控制的功能 then to the instance of GUIPazienteHandler which delegates GUIPrenotaVisitaHandler来管理任务的实例 服务  Uploading reservations  The request for the matter to the instance of GUIPrenotaVisitaHandler GUISelezionaPrenotazioniHandler是获得一份清单 all reservations made by the patient This object passes 监测哪个Prenotazioni经理的应用 through instances of reservation shall finding that list and return to the instance of GUISelezionaPrenotazioniHandler反过来应 可视化在掩码上获得的数据（应用程序 GUISelezionaPrenotazioni）  Selecting the reservation to be change  运营商从列表预订中进行选择 编辑和控制是向后传递的 GUIPrenotaVisitaHandler作为委员会的实例作为面板 Prenotazioni经理转移所有的任务 关于所选保留的信息请求 Prenotazioni管理器通过应用保留执行 这个任务，并返回到获得的数据实例 GUIPrenotaVisita反过来应该给 displaying on the screen on the management reservations (for instance GUIPrenotaVisita)  申请新的日期  操作员需要一个新的日期，当访问可以“ 保持和控制传递给的实例 GUIPrenotaVisitaHandler获得第二天 由适当的机构提供，以确保Prenotazioni经理 Viewing it in the mask on management of reservations (for instance GUIPrenotaVisita) 经营者确认了系统和控制建议的日期 is returned to the instance of GUIPrenotaVisitaHandler  Saving Reservation  此时应用类GUIPrenotaVisitaHandler proceeds for the reservation by delegating this task to the instance of this PrenotazioniManager through the application for reservation shall begin to validate the reservation and only if so rescue 关于预订的数据一旦这样 operation control is returned backward to GUIPrenotaVisitaHandler得到它的实例 用消息报告成功 掩盖管理保留（例如 GUIPrenotaVisita） 该功能是由该合作描述的 图3的图 "
"44","Cancel Reservation  该服务是在明确要求后发起的 由演员操作员登录形成 在主要部分患者（例如GUIPaziente）上 并选择取消预订 The control then goes to the instance of the GUIPazienteHandler 其中代表GUIEliminaPrenotazioniHandler的实例 管理服务的任务请求 GUIEliminaPrenotazioneHandler delegation application Prenotazioni经理是获得所有的列表 Reservations from Patient This object through the 请求保留以确保检索清单和 return to the instance of that GUIEliminaPrenotazioneHandler 转动提供获得的观看数据 在面具（例如GUIEliminaPrenotazione） The operator selects from the list by the reservation delete and control is passed to the instance of GUIEliminaPrenotazioneHandler which the request for delegation PrenotazioniManager of completing the transaction The application Prenotazioni经理通过申请预约应 以验证序列即使在之后也是有效的 消除保留 Only if so the elimination of reservation is completed and will return control GUIEliminaPrenotazioneHandler的实例 用消息通知交易成功 on the screen (for instance GUIEliminaPrenotazione) This 功能是由协作图来描述的 图3的20 "
"45","病人登录情景验证运行 The service was launched following the express request 由患者演员患者访问屏幕 on the management of the system (for instance GUISfondo）控制然后转到实例 GUISfondoHandler委托给GUILoginHandler的实例 the task of managing the service The first step to take is to enter the Hospital Patient Card and PIN and then 病人被提交到同一页面进行收购 这些数据（例如GUILogin）患者数据集和 confirms the insertion, and the scrutiny goes back to the application GUILoginHandler of derogating the validation of the application HospitalCardManager latter deals to validate the information 通过申请结果医院卡进入患者 被通知积极向后回升 GUILoginHandler的应用程序需要应用程序 允许GUIPrincipaleHandler访问患者 申请人然后安排展示 main form (for instance GUIPrincipale) This feature 它由图3的序列图描述 "
"46","登录失败的验证患者方案 这项服务是在明确要求之后发起的 by the Patient The actor Patient access to the screen 对系统的管理（例如 GUISfondo) Control then goes to the instance of GUISfondoHandler which delegates to the instance of GUILoginHandler 管理服务的任务是采取的第一步 是进入医院病人卡和PIN码然后 Patient is presented to the same page for the acquisition such data (for instance GUILogin) The tax Patient data 并确认包含，控制再次通过 to the instance of GUILoginHandler derogating validation HospitalCardManager到后者的实例交易 通过面板验证患者插入的数据 通知医院卡不成功操作 向后是GUILoginHandler的实例 to display an error message on form of access (for instance GUILogin) This feature is ` 已经由图3的序列图描述 "
"47","Show anagrafica The service was launched following the express request 由患者演员患者访问面罩 main (for instance GUIPrincipale) on the management of all services provided by the system to the request of patients 并选择他们的anagrafica的显示 主控制然后转到实例 GUIPrincipaleHandler代表的实例 GUIAnagraficaHandler在此管理服务的任务 点控制传递给PazienteManager的实例 which deals with finding by the panel of the Patient 患者资料申请者结果是 向后推到GUIAnagraficaHandler的实例 turn is responsible for their display on the screen on the management of registries of patients (for instance GUIAnagrafica）这个功能被描述了 图3的协作图9 "
"48","View list reservations The service was launched following the explicit request 由患者演员患者访问面罩 主要（例如GUIPrincipale）的管理 系统提供的所有服务都符合患者的要求 and there select the display of reservation 然后控制到的实例 GUIPrincipaleHandler which delegates to the instance of GUIPrenotazioniHandler在此管理服务的任务 Point control is passed to the instance of PrenotazioniManager which deals with finding through 所有预订的预订请求 请求结果的患者发送反向链接 到GUIPrenotazioniHandler进行交易的实例 他们在管理屏幕上的显示 The booking of patients (for instance GUIPrenotazioni) This feature is was described by the collaboration diagram 图3的10 "
"49","Show clinic folder 这项服务是在明确要求之后发起的 患者演员Patient的部分访问表单 主要（例如GUIPrincipale）的管理 系统提供的所有服务都符合患者的需求 并在那里选择他们的诊所文件夹的显示 The patient then passes control to the instance of GUIPrincipaleHandler which delegates to the instance of GUICartellaClinicaHandler the task of managing the service the first step to take is to find the data for Patient进行的所有访问和检查 applicant, and therefore control passes to the instance of CartellaClinicaManager At this point through a process 迭代是所有访问和所有访问的检索 步骤进行如下：身体的 VisiteManager found through the application of the data Visits 进行访问然后通过控制 EsamiManager application to ensure that through instances of 考虑找出所有考察的考察 At the end of this process, the results are sent 到CartellaClinicaManager的实例下一步 是找到有关病人的数据 申请人，因此控制权转移到了实例 PazienteManager through which the request for Patient Recovers 这些数据并将它们向后发送到实例 CartellaClinicaManager此时控制开关 GUICartellaClinicaHandler的实例 visualization of anagrafica data and Patient visits performed on the mask on the management of folders 诊所（例如GUICartellaClinica）这个功能是` 已经由图3的协作图来描述 "
